1126814	5231270	noct temperature	The two temperature fast dry method is to dehydrate first at the highest temperature setting, 145º F, for only the first two hours of dehydrating. This is because in the first few hours the temperature of the food will not exceed the critical 118º F temperature.
1126814	5231274	noct temperature	Food Temperature vs. Dial Settings-While your food is drying, the temperature of your food is about 20 to 25 degrees cooler than the air temperature in your dehydrator.
654723	848732	what does velvet symbolize	In the dream world, fairies can represent our hopes and desires. Maybe you've been going through a bad time and have been wishing that your fairy godmother would appear and make it all go away with her magic wand. They symbolize fantasy and can represent a need to escape reality.
1124979	7235855	synonym for treatment	'Opposite' implies the reverse of someone or something. For example, Antonym is the opposite of synonym. 'Opposite to' implies a position in physical space, i.e., 'facing'. For example, The supermarket was located right opposite to the old movie theatre.
474735	5231365	phone number for southwest airlines customer service	The email address of WhatsApp is support@WhatsApp.com. WhatsApp Website The Website of WhatsApp is www.whatsapp.com. WhatsApp Customer Support Service Phone Number The customer support phone number of WhatsApp is support@WhatsApp.com (Click phone number to call). data-ad-slot=7829909793> WhatsApp Customer Service Phone Number Whatsapp South Africa Customer Care Number WhatsApp California Customer Service Phone Number
11096	8487365	acura integra timing belt replacement cost	Reputation: 1. Posted. The Boxster doesn't have a timing belt-it utilizes a timing chain, and you're not going to have to replace that. What you do need to change is the polyrib serpentine belt which operates the engine's accessories like the water pump, a/c, alternator, etc.hanks, Good News! The Boxster doesn't have a timing belt-it utilizes a timing chain, and you're not going to have to replace that. What you do need to change is the polyrib serpentine belt which operates the engine's accessories like the water pump, a/c, alternator, etc.
11096	8487366	acura integra timing belt replacement cost	Thanks, Good News! The Boxster doesn't have a timing belt-it utilizes a timing chain, and you're not going to have to replace that. What you do need to change is the polyrib serpentine belt which operates the engine's accessories like the water pump, a/c, alternator, etc.hanks, Good News! The Boxster doesn't have a timing belt-it utilizes a timing chain, and you're not going to have to replace that. What you do need to change is the polyrib serpentine belt which operates the engine's accessories like the water pump, a/c, alternator, etc.
1105103	8487375	where is steph currys home in nc	1 View all Harnett County, NC jobs in Lillington, NC - Lillington jobs. 2  Salary Search: Processing Assistant Dss salaries in Lillington, NC.  Related forums: Harnett County, NC - Lillington, North Carolina.
146187	7235857	difference between a mcdouble and a double cheeseburger	Learn more at AnotherWordFor.info. Popular phrases for this post include, opposite of difference, difference opposite, opposite of differences, what is the opposite of difference, the opposite of difference, opposite word of difference, difference opposite word.
1105103	8487380	where is steph currys home in nc	1 View all Harnett County, NC jobs in Lillington, NC - Lillington jobs. 2  Salary Search: Income Maintenance Caseworker salaries in Lillington, NC.  Related forums: Harnett County, NC - Lillington, North Carolina.
1135377	5231365	edward jones phone number	The email address of WhatsApp is support@WhatsApp.com. WhatsApp Website The Website of WhatsApp is www.whatsapp.com. WhatsApp Customer Support Service Phone Number The customer support phone number of WhatsApp is support@WhatsApp.com (Click phone number to call). data-ad-slot=7829909793> WhatsApp Customer Service Phone Number Whatsapp South Africa Customer Care Number WhatsApp California Customer Service Phone Number
1128856	5231365	ira spar phone number	The email address of WhatsApp is support@WhatsApp.com. WhatsApp Website The Website of WhatsApp is www.whatsapp.com. WhatsApp Customer Support Service Phone Number The customer support phone number of WhatsApp is support@WhatsApp.com (Click phone number to call). data-ad-slot=7829909793> WhatsApp Customer Service Phone Number Whatsapp South Africa Customer Care Number WhatsApp California Customer Service Phone Number
1109818	8487401	what level for banish	verb. To relegate is defined as to send or assign to a lower place or position. An example of to relegate is someone being demoted from restaurant manager to dish washer.-·gat·ed, -·gat·ing. 1  to exile or banish (someone) to a specified place.2  to consign or assign to an inferior position: usually with to.o relegate is defined as to send or assign to a lower place or position. An example of to relegate is someone being demoted from restaurant manager to dish washer. -·gat·ed, -·gat·ing. 1  to exile or banish (someone) to a specified place. 2  to consign or assign to an inferior position: usually with to.
714453	8487531	what is an exercised stock option	When the price of an asset is directly linked to another price. Examples of parity price are: 1. Convertibles-the price at which a convertible security equals the value of the underlying stock. 2. Options-when an option is trading at its intrinsic value (trading at parity). 3.
1124145	5231478	truncating meaning	Roczen Meaning: The meaning of Roczen has not been submitted. If you have the meaning of Roczen, please submit it with along with any reference pages referring to the meaning of Roczen.Copyright 2004 - 2015 Meaning-of-Names.com-Powered by Swigity, LLC Meaning of Roczen Last Name-Surname-Family Name Roczen.
1121166	8487685	what causes meteor shower on earth	One of the smartest bathroom shower ideas is to pair a sturdy acrylic, one-piece shower pan with tiled walls. You have the beauty of tile, with none of the unreliability of a tiled shower pan. I have seen a lot of ugly shower bases out there, so these bases from Lasco Bathware come like a breath of fresh air.
523270	7236537	toyota of plano plano tx	All Home Depot hours and locations in Texas: Houston,San Antonio,Austin,Dallas,Fort Worth,Plano,Corpus Christi,El Paso... Get store opening hours, closing time, addresses, phone numbers, maps and directions.
1126814	7236546	noct temperature	Keep them at room temperature (20–23 deg. C), away from heating radiators and out of direct sunlight. b. testing temperature conditions In this experiment, you are investigating whether or not temperature affects seed dormancy and germination. The idea is to expose seeds to many different temperature conditions and then measure the number of seeds breaking dormancy at each temperature.
646207	8081549	what does production design entail	Books. 1  Production Design and Art Direction (Focal Press) by Peter Ettedgui. 2  By Design: Interviews with Film Production Designers (Greenwood Press) by Vincent LoBrutto. 3  Film Architecture: From Metropolis to Blade Runner (Prestel Publishing Ltd). Edited by D. Neumann 2001. 4  Filming the Future (Aurum Press Ltd) by Piers Bizony.
1117387	7236666	chevy chase meaning	2017 Chase Bank Holidays. Chase Bank will be closed on the days listed below. Please keep in mind that these are not necessarily the actual holidays but the days the institution observes the holiday. If the holiday is not listed below, Chase Bank will not be closed for that holiday.
952774	7236718	when is the evening	Time-wise, though, the morning is often defined as from 5 am to 12 noon. :: Evening :: Informally, the evening is the period in which the daylight is decreasing, between the late afternoon and night; it extends from the latter portion of the daylight (before sunset) until dark (after sunset). Typically between 5 and 11 pm. Euphemistically the evening is also the latter part of a person's life.
964223	7237103	when will the next eclipse occur	About Using Eclipse Map The blue marker with eclipsed sun at the top shows the position of the greatest eclipse. The greatest eclipse is the point where the total eclipse can be observed for the maximum duration.
507445	8488196	symptoms of different types of brain bleeds	There are two types of brain injury: traumatic brain injury and acquired brain injury. Both disrupt the brain’s normal functioning. Traumatic Brain Injury (TBI) is caused by an external force -- such as a blow to the head -- that causes the brain to move inside the skull or damages the skull.
573724	8488412	what are the social determinants of health	The program addresses problems of disease causation and prevention, the multiple determinants of population health, optimal health care delivery, and allocation of health-related resources. According to the Association of Schools of Public Health, public health and the clinical professions are distinct.
883785	8488530	what origin is the last name Goins	1 Open the Origin client and click the Friends button, then Add a Friend. If you do not have the Origin client installed, you can download Origin for both PC and Mac.  In the Import Friends menu, you can choose to connect your Xbox LIVE, PSN, and EA accounts. Simply sign in with your account details to connect.
87452	8081937	causes of military suicide	Military and civilian fatalities. According to WHO World health report 2004, deaths from intentional injuries (including war, violence, and suicide) were estimated to be 2.8% of all deaths. In the same report, unintentional injury was estimated to be responsible for 6.2% of all deaths. See also. List of causes of death by rate
133358	8081946	definition of coining money	Remit definition, to transmit or send (money, a check, etc.) to a person or place, usually in payment. See more.
264403	8082019	how long is recovery from a face lift and neck lift	If you’re using a typical street performance cam in a smallblock Chevy V8 that produces .480˝ of total lift at the valve, the cam itself is only producing about .320˝ of lift at the lobe. The 1.5 ratio rocker arms multiply the lift (.320 x 1.5) to achieve the .480˝ of lift at the valve.
1121402	8082037	what can contour plowing reduce	Once you learn to read the income statement, you can use the retained earnings figure to decide on how wisely management is deploying and investing the shareholders' money. If you notice a company is plowing all of its earnings back into itself and isn't experiencing exceptionally high growth, you can be sure that the stockholders would be better served if the board of directors declared a dividend instead.
499920	5232625	socioemotional processes definition	A rock cycle is the process by which one rock type changes intoanother. What is the definition of the rock cycle? A rock cycle is a series of processes of how rocks change.
714453	8082236	what is an exercised stock option	A local tax policy option that has been exercised widely in Virginia is use value taxation. Since its 1972 inception into Virginia law, the stated intent of use value taxation has been to foster he preservation of real estate for agricultural, horticultural, forest and open space use in the public interest..
541571	8082472	wat is dopamine	What does scofflaw mean? Sum1 did not go 2 court & it says defendant declared a scofflaw.wat does this mean & wat will happen 2 them? Is it even remotely possible that KENNETH LAY,Republican scofflaw and pal of Dubya actually faked his death?
527433	8082575	types of dysarthria from cerebral palsy	With that said, there are a number of common complications that can arise from stroke in newborns. Cerebral palsy is the most common complication. Epilepsy, language problems, cognitive or behavioural problems, headache disorders, and seizure disorders can all emerge as a result of newborn stroke.
645693	808258	what does pk nail stand for in survey	Usually, nail fungus occurs when fungus enters the nail through a small trauma (cut or break) in the nail. Nail fungus is not caused by poor hygiene. Nail fungus can be spread from person to person. It may be hard to determine exactly where or how a fungal infection is acquired.
719381	8082592	what is ar balance	Walgreens, 200 E Race Ave Searcy, AR 72143 (501-279-1125). Whether you are looking for information about Walgreens, searching for a top Pharmacies business near me or within zip code 72143, or just trying to locate a company that offers Pharmacies near Searcy AR, you will find that b2bYellowpages.com will satisfy your search.
194013	5232947	generic vivelle dot cost	Shooters using the red dot scopes should try to use their dominant eye to view the dot. I see this dot so naturally with my left eye (even though I'm right-handed) that I don't need to occlude my right non-dominant eye. My brain would suppress the scope image of my right eye.
1115776	5232959	what is an aml surveillance analyst	First, securities firms are responsible for complying with all AML requirements to which they are subject. Although this research guide summarizes some of the key AML obligations that are applicable to broker-dealers, it is not comprehensive.
1115776	5232963	what is an aml surveillance analyst	Second, AML laws, rules, and orders are subject to change and may change quickly. Statutes that include AML-related provisions may be amended from time to time, and new statutes may be enacted which include AML-related provisions. The information summarized in this guide is current as of May 1, 2012.
306076	5233056	how much do it cost to get your bachelor degree online	An associate degree in psychology is an undergraduate-level program that typically takes 2 years to complete. On the other hand, a bachelor's degree in psychology takes 4 years to complete. As for higher qualifications, you have the option of a master's in psychology that can take between 2 and 3 years.. Bachelors Degree in Psychology-this is an undergraduate level program that typically takes about four years to complete, however the duration may vary if you enroll in an online course. Most colleges offer the option of choosing between a Bachelor of Arts (B.A.), or a Bachelor of Science (B.S.) degree.
1108307	5233228	what trail did thousands use to get to the gold rush	The Price of Gold. In the context of the ideas of the 1850’s, the Australian gold rush came as a disruption to pervading agrarian ideologies that saw the new colony as a scene of cultivation, grazing and farming.he Price of Gold. In the context of the ideas of the 1850’s, the Australian gold rush came as a disruption to pervading agrarian ideologies that saw the new colony as a scene of cultivation, grazing and farming.
1133328	523328	how far prior to wedding should you mail out invitations	Your wedding invitations will have a start time listed on them, and no matter how hard you try, some of your guests will arrive early and some will arrive late. Therefore, we suggest that you send out invites with a start time 15 minutes before the actual ceremony starting time.This way, any late guests won’t have to awkwardly sneak into their seats as your wedding party is already making their way down the aisle.his sample wedding follows a timeline in which the ceremony starts at 5pm. 12:00 PM Start hair and makeup for you and your bridesmaids. 2:00 PM Getting ready pictures begin – feel free to ask your photographer for fun poses as well as candid shots. 2:30 PM Put on the wedding dress, creating a picture-perfect photo op.
953067	5233307	when is the month of autism awareness	Autism is a spectrum disorder, ranging from severe, low-functioning classic autism to the milder Asperger's syndrome (also known as high-functioning autism). What separates the high-functioning from the severe is often their intelligence quotient.
1128856	8083037	ira spar phone number	88 meanings of SPAR acronym and SPAR abbreviation. Get the definition of SPAR by All Acronyms dictionary. Top Definition: Spartan Motors, Inc.
1128856	8083040	ira spar phone number	Learn More about spar See words that rhyme with spar Spanish Central: Translation of spar Nglish: Translation of spar for Spanish speakers Britannica English: Translation of spar for Arabic speakers Seen and Heard What made you want to look up spar? Please tell us where you read or heard it (including the quote, if possible).
1128856	8083043	ira spar phone number	SPAR stands for. 1  13. SPAR. Spartan Motors, Inc. 2  9. SPAR. Status of Permit Application Report. 3  9. SPAR. School Public Accountability Report. 4  8. SPAR. Seagoing Platform for Acoustic Research. 5  8. SPAR. Spill Prevention and Response. 6  8. SPAR. Supplemental Prisoner Adjustable Restraint. 7  7. SPAR. Symbolic Program Assembly Routine. 8  7. SPAR.
1115776	5233462	what is an aml surveillance analyst	Security camera coaxial cable is used to transmit the video from the surveillance cameras to the front end. The maximum distance the surveillance cameras can be from the front end is a function of the cable rather than the surveillance camera itself. Using RG59 coaxial cable, you can extend the camera out to 600'. Using RG6 coax cable, you can extend it to 1000'.
1104031	5233549	which units can be used to express force?	This is expressed as W = F x d. Work is measured in units called joules (pronounced jools). When you hold your arms over your head, you aren't moving anything. But mechanical work involves both force and distance, and there isn't any distance. Ergo, you're doing no mechanical work.
1106293	5233595	when shazam movie released	Fans of the franchise have not just one more movie to look forward to, but FIVE more. Episode VIII is going to be released in theaters on May 26, 2017 while Episode IX is expected to hit theaters sometime in 2019. Make sure to read everything we know about Episode 8 so far! Before we get more movies in the trilogy, Rogue One starring Felicity Jones will be released on December 16, 2016.
573724	8083118	what are the social determinants of health	Role 1: Bridge the gap between communities and the health and social service systems. 1  Enhance care quality by aiding communication between provider and patient to clarify cultural practices. 2  Educate community members about how to use the health care and social service systems. Educate the health and social service systems about community needs and perspectives. Establish better communication processes. Role 2: Navigate the health and human services system
654723	8083183	what does velvet symbolize	Chocolate gold coins which are symbolic of the famous story of St. Nicholas dropping gold down a chimney or through a window to provide dowries for three poor women; Oranges also traditionally symbolize the gold the St. Nicholas gave away; Candy canes which symbolize the shepherd’s crook or crozier of a Bishop
694342	5233759	what is a period calculus	In addition to his work on calculus, as a mathematician Newton contributed to the study of power series, generalised the binomial theorem to non-integer exponents, developed a method for approximating the roots of a function, and classified most of the cubic plane curves.