47923	8077447	axon terminals or synaptic knob definition	power input definition - The power presented to the input terminals of a component, circuit, device, piece of equipment, or system. Also called input power (1). Dictionary Of Engineering
499920	8077453	socioemotional processes definition	Our modification of classic definitions of institution (including Rational Choice definitions) is intended to elicit discussion concerning the differences between traditional and peer-to-peer or virtual institutions. What would it mean to start with a definition that emphasized social networks and the processes of creating those networks? In any new definition, something is gained and something is lost.
574575	7232215	what are the three distinct layers of the earth?	Based on the differences in lamination the cerebral cortex can be classified into two parts, the large area of neocortex and the much smaller area of allocortex: The neocortex (also known as the isocortex or neopallium) is the part of the mature cerebral cortex with six distinct layers.
451602	7232293	medicare's definition of mechanical ventilation	Adaptive Support Ventilation ® (ASV ®) Intelligent ventilation mode for passive and spontaneously breathing adult and pediatric patients Automatically adjusts ventilation to lung mechanics and applies lung-protective strategies
359349	7232313	how to find the midsegment of a trapezoid	Parallel means non-intersecting. For example, parallel lines means that if the two lines kept going forever, they would never cross over each other—they would always be an equal distance apart. Rectangle. Another box shape, with two sets of equal sides. Equal sides are opposite each other. The sides are parallel to each other. It’s drawn like this: Trapezoid. Another 4 sided shape, with one set of parallel lines (the other set of lines is not parallel), drawn like this: Pentagon. A shape with five sides.
654723	5227862	what does velvet symbolize	Red and white colors of the flag symbolize the golden period of Inca Empire in Peru. The red stripes also represent the blood shed in the fight for Peruvian freedom, while the white stands for peace and justice.ed and white colors of the flag symbolize the golden period of Inca Empire in Peru. The red stripes also represent the blood shed in the fight for Peruvian freedom, while the white stands for peace and justice.
1055865	72324	who was the first african-american to win wimbledon	Wimbledon   Municipal center in the Greater London borough of Merton, known as the site of the annual lawn-tennis All-England Championships.Held in late June and early J … uly, the tournament is the oldest (founded 1877) and most prestigious in the world. Watching Wimbledon on television is okay, but being there is an ex…. 2  Wimbledon Tickets: Information And Application Details Demand for Wimbledon tickets has significantly exceeded supply for most of the tennis championship's history since it began in 1877.
1106007	5228014	define visceral?	The pleural membrane is made up of two layers. These layers can be illustrated in a transverse section of the thoracic cavity. The visceral or pulmonary pleura covers the outside of the lungs, and the parietal or costal pleura lines the inside of the chest wall, and it extends over the top of diaphragm.he visceral pleura surrounds the outside of the lung. The parietal pleura lines the inside of the chest wall and extends over the diaphragm. These membranes secrete a lubricating fluid, which allows for free movement of the lungs against the chest wall when we breathe.
1106007	5228015	define visceral?	The lungs are surrounded by two membranes, the pleura. The outer pleura is attached to the chest wall and is known as the parietal pleura; the inner one is attached to the lun … g and other visceral tissues and is known as the visceral pleura.In between the two is a thin space known as the pleural cavity or pleural space.he outer pleura is attached to the chest wall and is known as the parietal pleura; the inner one is attached to the lun … g and other visceral tissues and is known as the visceral pleura.
885490	5228107	what party is paul ryan in	I really think if Trump wants a show for everyone to watch he should have Sarah Palin, Michele Bachmann, Ted Cruz, Rand Paul, Mitch McConnell, Mitt Romney, Scott Walker and Paul Ryan to mention a few on his show and watch them in action how to run a business let alone a country.
11096	5228126	acura integra timing belt replacement cost	The average cost for a timing belt replacement is between $340 to $457. Labor costs are estimated between $287 to $363 while parts are priced between $53 to $94. Get a personalized estimate based on your location and specific car.
11096	5228127	acura integra timing belt replacement cost	1 Having a mechanic or repair shop replace the timing belt (and possibly the serpentine belt and accessory belt at the same time) can cost $150-$1,000 or more, depending on the make, model and type of vehicle.
11096	5228128	acura integra timing belt replacement cost	1 Parts typically cost $25-$80 or more for just the timing belt, depending on vehicle make and model; or $100-$800 or more for a kit that also includes other recommended replacement parts like seals, the tensioner or a water pump. 2  CostHelper readers report.
11096	5228131	acura integra timing belt replacement cost	According to costhelper.com, the cost of timing belt replacement varies between £162 and £487, depending the make and model of the car as well as the price of the labour.
1127893	8484510	ben foster footballer net worth	[image via Pummax] 1  Robert Kiyosaki Net Worth. Les Gold Net Worth. 2  Robert Herjavec Net Worth. Mellody Hobson Net Worth. 3  Barbara Corcoran Net Worth. Larry Ellison Net Worth. 4  Load more posts.
1103812	723320	who formed the commonwealth of independent states	Massachusetts, like Pennsylvania, Virginia, and Kentucky, is called a Commonwealth. Commonwealths are states, but the reverse is not true. Legally, Massachusetts is a commonwealth because the term is contained in the Constitution.
474735	8078482	phone number for southwest airlines customer service	The postal and official address, email address and phone number (helpline) of Marshall AMP Service Center and Marshall AMP customer service phone number is given below. The helpline of Marshall AMP customer service phone number may or may not be toll free. Click Here To View Marshall AMP Customer Service Phone Numbers
277780	5228639	how many calories in tablespoon mayonnaise	Use yogurt in place of oil. You can use buttermilk, yogurt, sour cream or mayonnaise instead of oil. Mayonnaise may sound like a stretch, but it comes closest to oil and, surprisingly, does not alter the taste of the cake. Sour cream often substitutes for mayonnaise, so you can also use it in a cake.
645693	8078496	what does pk nail stand for in survey	What does PK stand for? What does PK mean? This page is about the various possible meanings of the acronym, abbreviation, shorthand or slang term: PK.
1133167	8484845	how is the weather in jamaica	Live weather in Montego Bay. The latest and today's weather in Montego Bay, Jamaica updated regularly.
691330	7233328	what is a moderator variable	If you are earning credits from more than one faculty moderator or are interning at more than one site, you will need to submit a Registration for Internship - Learning Contract for each one. If your internship will take place over two semesters you will need to register for each semester separately.
1111546	8078508	what is the medium for an artisan	Pepperidge Farm Fresh Bakery Jewish Rye & Pumpernickel Deli Swirl Bread Nature's Own Sugar Free 100% Whole Grain Bread Dr. Schar Gluten Free Artisan Baker White Bread
180442	8078524	enemy of the state film cast	Kurtz: “The horror, the horror.” These are Kurtz’s last words, uttered after Willard brutally slaughters him with a machete and repeated as the film fades to black at its end. The words revisit a monologue Kurtz delivers to Willard earlier in the film, intimating that if horror is not made to be one’s friend, it becomes “an enemy to be feared.” Kurtz’s last words—also spoken by Kurtz at the end of Conrad’s novella Heart of Darkness—are enigmatic and can be taken to indicate several different outcomes.
574575	8078577	what are the three distinct layers of the earth?	Definition of landfill. 1  1 : an area built up by landfill. 2  2 : a system of trash and garbage disposal in which the waste is buried between layers of earth to build up low-lying land —called also sanitary landfill.
1059231	7233447	who wrote the song look at me now song	So, in that way, “Chasing Pavements” was quite intentional, though the way the song itself came about definitely wasn’t! The night before I wrote it was the same night I actually met the boy the album’s written about!
1059231	7233453	who wrote the song look at me now song	First the Real Housewives of Atlanta star wrote, co-directed, and produced a play (possibly heading to broadway soon!) called A Mother's Love about dealing with mamas who do not support their daughter's choices and now Kandi wrote a new song called Let Them Love. Kandi's song is now available on iTunes and it's really good! In other Kandi business, interestingly she shares a stylist with former friend, whom she is now suing, Kim Zolciak!
1117387	5228939	chevy chase meaning	QU40637 30 Spline Right Inner Axle Shaft for 1973 to 1980 Chevy, GMC Dana 44 Front Axles is a genuine original equipment Dana Right Inner axle shaft for all Dana 44 front axles in 1973 to 1980 Chevy Blazers, GMC Jimmys, plus Chevy, GMC 4x4 1/2 ton or 3/4 ton Pickups and Suburbans.
694342	8485042	what is a period calculus	Linear logic lends itself to many different presentations, explanations and intuitions. Proof-theoretically, it derives from an analysis of classical sequent calculus in which uses of (the structural rules) contraction and weakening are carefully controlled.
1005165	8485083	which amendment protects a person from cruel or unusual punishment	The Fourth Amendment right against unreasonable searches and seizures, made applicable to the States by the Fourteenth Amendment, protects people, not places, and therefore applies as much to the citizen on the streets as well as at home or elsewhere. Pp. 8-9.
451602	8485131	medicare's definition of mechanical ventilation	Inclusion Criteria: 1  Patients using artificial airway (intubation and / or tracheostomy) 2  Duration of mechanical ventilation longer than 24 hours. 3  weaning from mechanical ventilation.  18 years of age or 1  older. Motor Activity Assessment Scale (MAAS)  3-4.
490595	8485139	rsa definition key	RSA (cryptosystem) For other uses, see RSA (disambiguation). RSA is one of the first practical public-key cryptosystems and is widely used for secure data transmission. In such a cryptosystem, the encryption key is public and differs from the decryption key which is kept secret. In RSA, this asymmetry is based on the practical difficulty of factoring the product of two large prime numbers, the factoring problem.
835929	8078793	what is the national convention	How to donate to Red Cross Hurricane Harvey relief. In honor of the Democratic National Convention in Philadelphia, a local youth literacy organization attempts a Guinness World Record for the most children writing at the same place at the same time.
287683	8078812	how many liberty ships were built in brunswick	Safety was not Liberty and Liberty was not safe. Our concept of liberty today is pale and thin compared with that of the Founders. Today we want to believe in liberty (small “l”), but not so much that we could get hurt.
654723	8485171	what does velvet symbolize	Cashmeran: an aroma chemical with a spicy, ambery, musky, floral odor. Meant to add a powdery, velvet nuance that invokes the smell or feel of cashmere. Often listed in fragrance notes as cashmere woods.
833860	5229080	what is the most popular food in switzerland	Food Cravings & What Your Body Really Wants. Learn what your body is trying to tell you by the food cravings you’re having. We’ve uncovered the most popular food cravings and provide healthy alternatives so you can crave your way to a healthy lifestyle. Foods That Give You Energy.
972007	7233740	where do white sox play in chicago	With a capacity of 15,000, Sloan Park is the largest spring training stadium by capacity in Major League Baseball, surpassing Camelback Ranch in Glendale (coincidentally, spring training home of the Cubs' in-city rival the Chicago White Sox) by 2,000 seats.
1114646	8078874	what is famvir prescribed for	Meaning: A rite or body of rites prescribed for public worship. Classified under: Nouns denoting acts or actions. Hypernyms (liturgy is a kind of...): religious rite; rite (an established ceremony prescribed by a religion) Hyponyms (each of the following is a kind of liturgy): Christian liturgy (the Christian worship services)
1108100	8078967	what type of movement do bacteria exhibit?	What type of energy transformation does a sailboat have? A sailboat uses energy from the wind. I don't think this is reallyan energy transformation; movement energy from the wind isconverted into boat movement.
443396	8079039	lps laws definition	1) An LPS designated facility, private or County 2) Any designated facility in LA County only. 3) Medical units in an LPS designated facility only *Special Note: The law (WIC 5170) provides for involuntary detention of inebriates (chronic alcoholics) however there are no LPS designated hospitals in LA County for inebriation.
443396	8079040	lps laws definition	Looking for the definition of LPS? Find out what is the full meaning of LPS on Abbreviations.com! 'LipoPolySaccharide' is one option -- get in to view more @ The Web's largest and most authoritative acronyms and abbreviations resource.
199143	7233903	has trump ever said individual u.s tax rate highest in world	On a U.S. map, the Tax Foundation shows that the following 10 states (and counting the District of Columbia) have the highest individual income tax rates in 2014: California, 13.3% Hawaii, 11.0%
199143	7233904	has trump ever said individual u.s tax rate highest in world	Download FISCAL FACT No. 544: State Individual Income Tax Rates and Brackets for 2017 (PDF) Download State Individual Income Tax Rates and Brackets 2017 (XLSX) Key Findings: Individual income taxes are a major source of state government revenue, accounting for 36 percent of state tax collections. Forty-three states levy individual income taxes. Forty-one tax wage and salary income, while two states—New Hampshire and Tennessee—exclusively tax dividend and interest income. Seven states levy no income tax at all. Tennessee is currently phasing out its Hall Tax (income tax applied only to dividends and interest income) and will repeal its income tax entirely by 2022.[2] Of those states taxing wages, eight have single-rate tax structures, with one rate applying to all taxable income.
427578	522952	is the titanic the biggest ship ever	Cobh: Titanic’s last port of call. Queenstown (known as Cobh today) was Titanic’s last port of call before disaster struck. The legendary ship has left an undeniable mark on this maritime town. For the 123 people that would leave on Titanic from her last port of call, Cobh was the a gateway to the new world.
634428	8079173	what does chs stand for?	Twelve South HiRise Adjustable Stand for MacBook Pro and MacBook Air - Previous Gallery Image Twelve South HiRise Adjustable Stand for MacBook Pro and MacBook Air - Next Gallery Image Twelve South HiRise Adjustable Stand for MacBook Pro and MacBook Air $69.95
654723	7234020	what does velvet symbolize	Prague State Opera The building was reconstructed during the eighties. Nevertheless, it still maintains certain elements from the late nineteenth century since it was first built such as the red velvet, the chandeliers and the gilded stucco
1063750	8079316	why did the us volunterilay enter ww1	Causes of WW1: Imperialism Imperialism is when a country takes over new lands or countries and makes them subject to their rule. By 1900 the British Empire extended over five continents and France had control of large areas of Africa.
499920	8079341	socioemotional processes definition	CRM Definition. According to Wikipedia, “The generally accepted purpose of Customer Relationship Management (CRM) is to enable organizations to better serve their customers through the introduction of reliable processes and procedures for interacting with those customers”. Which is as good a CRM definition as any. History of CRM
499920	7234276	socioemotional processes definition	Natural Processes Leading to Lake Formation. Natural lakes can form by various processes. Although many of these processes occurred in the geologic past, lakes continue to form and to be destroyed. For example, an earthquake-triggered landslide created Lake Sarez in Tajikistan only three generations ago.
964223	8485897	when will the next eclipse occur	Not to be confused with Lunar eclipse. As seen from the Earth, a solar eclipse is a type of eclipse that occurs when the Moon passes between the Sun and Earth, and the Moon fully or partially blocks (occults) the Sun. This can happen only at new moon, when the Sun and the Moon are in conjunction as seen from Earth in an alignment referred to as syzygy. In a total eclipse, the disk of the Sun is fully obscured by the Moon. In partial and annular eclipses, only part of the Sun is obscured.
89928	7234406	ceramic-tiles how much the cost for square foot	Tiles are often used to form wall and floor coverings, and can range from simple square tiles to complex mosaics. Tiles are most often made of ceramic, typically glazed for internal uses and unglazed for roofing, but other materials are also commonly used, such as glass, cork, concrete and other composite materials, and stone. Tiling stone is typically marble, onyx, granite or slate. Thinner tiles can be used on walls than on floors, which require more durable surfaces that will resist impacts.
855434	5229987	what is therapy that explores relationship problems	Use the Pythagorean relationship to calculate the measure of the third side of a right triangle, given the other two sides. Using the Pythagorean Relationship: Grade 8 Lesson 32.02. Solve problems involving the radii, diameters, and circumferences of circles.
133358	8079710	definition of coining money	money hungry definition, money hungry meaning | English dictionary. money. n (Chiefly Brit) a sum of money deposited as security for good conduct, against possible debts, etc. 1 a reward paid for the capture or slaying of a fugitive, outlaw, etc. n another name (esp.
479871	5230112	presidential synonym	List of Barack Obama presidential campaign staff members, 2008. List of persons holding prominent positions within the Barack Obama presidential primary campaign, 2008.
1112389	8486308	what is the county for grand rapids, mn	1 The population density in Wisconsin Rapids is 1146% higher than Wisconsin. 2  The median age in Wisconsin Rapids is 6% higher than Wisconsin. 3  In Wisconsin Rapids 90.62% of the population is Caucasian. 4  In Wisconsin Rapids 0.56% of the population is African American.  In Wisconsin Rapids 4.71% of the population is Asian.
835929	5230247	what is the national convention	The Hidden Meaning in Melania Trump’s Convention Dress. Melania Trump wore a white dress by Roksanda Ilincic, a Serbian-born designer based in London, for her speech at the Republican National Convention. On Monday night, the world was formally introduced to Republican nominee Donald Trump’s wife, Melania.
835929	5230248	what is the national convention	Melania Trump wore a white dress by Roksanda Ilincic, a Serbian-born designer based in London, for her speech during the Republican National Convention.
183378	8079968	exons definition biology	2 meanings of NAD acronym and NAD abbreviation in Biology. Get the definition of NAD in Biology by All Acronyms dictionary. Top Definition: Nicotinamide adenine dinucleotide In Biology. Search for acronyms, abbreviations,
1126813	5230425	noe fractures	Summary of Diametaphyseal forearm fracture in childhood: Pitfalls and recommendations for treatment.. The optimal treatment for fractures in the diametaphyseal transition zone of the forearm is still a matter of debate. Stable fractures should be immobilized or treated by closed reduction when non-tolerably displaced.
130510	723495	definition declaratory judgment	A  motion to set aside judgment  asks the court to vacate or nullify a judgment and/or verdict. Motions may be made at any time after entry of judgment, and in some circumstances years after the case has been closed by the courts.
1056204	8486440	who was the first steam boat operator	Visitors do not need a saltwater fishing license or a snook or spiny lobster *permit if... 1  You fish from a for-hire vessel (guide, charter, party boat) that has a valid vessel license. 2  You fish from a vessel, the operator of which has a valid vessel license issued in the name of the operator of the vessel. You are saltwater fishing during Free Fishing Days. 2  You fish for recreational purposes from a pier with a valid pier saltwater fishing license. 3  You have a valid saltwater products license or FWC charter captain license (does not apply to charter boat license or U.S. Coast Guard license).
500575	8080328	sop's policy	What Types Of Policies are Participating? Whole life insurance policies are usually the only type of policy that is paid a dividend, and therefore is considered to be participating. This is true for an individual whole life insurance policy, and usually an ordinary whole life insurance policy (a whole life policy from a group plan).
452431	5230752	melanoma skin cancer symptoms	Distinguishing benign moles from melanoma. According to recent research, certain moles are at higher risk for changing into cancerous growths, including malignant melanoma, a form of skin cancer. Moles that are present at birth and atypical moles have a greater chance of becoming malignant.
452431	5230757	melanoma skin cancer symptoms	Most moles are benign and no treatment is necessary. Some benign moles may develop into skin cancer (melanoma). See below for signs. Atypical moles (dysplastic nevi). Larger than normal moles (more than a half inch across), atypical moles are not always round.
1123581	7235271	calculate my social security benefit per month	There are two tiers in the Railroad Retirement Plan, which can help you calculate your benefits. Tier 1 gives workers basic credits, which can be used in both the Railroad Retirement and Social Security systems. 1  It uses Social Security formulas to calculate payments to retirees, but uses Railroad Retirement ages and service periods.
588587	7235287	what causes heavy metal toxins in your body	4. Supports Overall Colon Health. All the toxins you take into your body will eventually make their way to the colon. By not cleansing your colon (and liver), toxins can linger in the body and cause untold damage. Ridding the body of waste supports the many functions of the colon, including digestion and proliferation of beneficial gut flora. 5. Encourages Whole Body Detox. The body is adept at constantly detoxifying itself every day.
292906	5230813	how many people use google in one day	This is a good option if you want to share viewing access to a document to a large group of people. 1  Go to Google Drive at drive.google.com and log in using your Google account. 2  Find your document in your list. 3  Click on the file name on the list to open the file. 4  Click on the Share tab on the upper right-hand corner of the window.
1125225	5230907	bond strike price	What is the price of the bond? N = 20 I/Y = 4.5 PV = -1065.04 PMT = 50 FV = 1000 Yield to maturity--semiannual bond 5. A corporate bond has a face value of $1,000, and pays a $50 coupon every six months (that is, the bond has a 10 percent semiannual coupon). The bond matures in 12 years and sells at a price of $1,080.
883785	8080631	what origin is the last name Goins	exporters written certification of the origin of the goods. The certification is essential to substantiate compliance with the rules of origin under the Agreement. You are required to give us this information to obtain a benefit. NORTH AMERICAN FREE TRADE AGREEMENT CERTIFICATE OF ORIGIN INSTRUCTIONS
634428	5230973	what does chs stand for?	=== What Does UPC Stand For? === By What Does ____ Stand For? Like and subscribe for more acronyms and abbreviations. === What Does UPC Stand For? === By What Does ____ Stand For?
1055865	5230993	who was the first african-american to win wimbledon	Norcell was one of the first four African-American students to be admitted to the University of Texas, and was the second African American to graduate from the UT School of Architecture in 1960.
292906	808090	how many people use google in one day	Control your Nest with your voice. With Google and Nest, it's now even easier to change the temperature in your home. You can ask Google to set the temperature of your Nest Thermostat through your phone, tablet or computer. To get started, just open the Google app and tap the mic, or say Ok Google.
1059231	5231236	who wrote the song look at me now song	While most people know The Bangles’ version of “Manic Monday ,” the song was actually written by Prince for the group Apollonia 6.The Purple One wrote it under a pseudonym, Christopher, and originally recorded a demo of the song with Apollonia 6 as a collaboration before deciding their version didn’t really work.hile most people know The Bangles’ version of “Manic Monday ,” the song was actually written by Prince for the group Apollonia 6.
